{
    "$schema": "http://json-schema.org/draft-07/schema#",
    "type": "object",
    "required": ["version", "disable_existing_loggers", "formatters", "handlers", "loggers", "root"],
    "properties": {
        "version": {
            "type": "integer",
            "enum": [1],
            "description": "Schema version, must be 1 for Python logging"
        },
        "disable_existing_loggers": {
            "type": "boolean",
            "description": "Whether to disable existing loggers when configuring"
        },
        "formatters": {
            "type": "object",
            "description": "Logging formatters configuration",
            "patternProperties": {
                "^[a-zA-Z0-9_]+$": {
                    "type": "object",
                    "required": ["format"],
                    "properties": {
                        "format": {
                            "type": "string",
                            "description": "Format string for log messages"
                        },
                        "datefmt": {
                            "type": "string",
                            "description": "Date/time format string"
                        }
                    }
                }
            }
        },
        "handlers": {
            "type": "object",
            "description": "Logging handlers configuration",
            "patternProperties": {
                "^[a-zA-Z0-9_]+$": {
                    "type": "object",
                    "required": ["class", "level", "formatter"],
                    "properties": {
                        "class": {
                            "type": "string",
                            "enum": [
                                "logging.StreamHandler",
                                "logging.FileHandler",
                                "logging.handlers.RotatingFileHandler",
                                "logging.handlers.TimedRotatingFileHandler"
                            ],
                            "description": "Handler class"
                        },
                        "level": {
                            "type": "string",
                            "enum": ["DEBUG", "INFO", "WARNING", "ERROR", "CRITICAL"],
                            "description": "Logging level"
                        },
                        "formatter": {
                            "type": "string",
                            "description": "Formatter name to use"
                        },
                        "filename": {
                            "type": "string",
                            "description": "Log file path (for file handlers)"
                        },
                        "maxBytes": {
                            "type": "integer",
                            "description": "Maximum file size before rotation"
                        },
                        "backupCount": {
                            "type": "integer",
                            "description": "Number of backup files to keep"
                        },
                        "stream": {
                            "type": "string",
                            "enum": ["ext://sys.stdout", "ext://sys.stderr"],
                            "description": "Output stream (for StreamHandler)"
                        }
                    }
                }
            }
        },
        "loggers": {
            "type": "object",
            "description": "Logger configurations",
            "patternProperties": {
                "^[a-zA-Z0-9_.]+$": {
                    "type": "object",
                    "required": ["level", "handlers"],
                    "properties": {
                        "level": {
                            "type": "string",
                            "enum": ["DEBUG", "INFO", "WARNING", "ERROR", "CRITICAL"],
                            "description": "Logging level"
                        },
                        "handlers": {
                            "type": "array",
                            "items": {
                                "type": "string"
                            },
                            "description": "List of handlers to use"
                        },
                        "propagate": {
                            "type": "boolean",
                            "description": "Whether to propagate to parent loggers"
                        }
                    }
                }
            }
        },
        "root": {
            "type": "object",
            "required": ["level", "handlers"],
            "description": "Root logger configuration",
            "properties": {
                "level": {
                    "type": "string",
                    "enum": ["DEBUG", "INFO", "WARNING", "ERROR", "CRITICAL"],
                    "description": "Logging level"
                },
                "handlers": {
                    "type": "array",
                    "items": {
                        "type": "string"
                    },
                    "description": "List of handlers to use"
                }
            }
        }
    }
} 