{
    "version": 1,
    "disable_existing_loggers": false,
    "formatters": {
        "standard": {
            "format": "%(asctime)s | %(levelname)-8s | %(name)s:%(funcName)s:%(lineno)d - %(message)s",
            "datefmt": "%Y-%m-%d %H:%M:%S"
        }
    },
    "handlers": {
        "console": {
            "class": "logging.StreamHandler",
            "level": "INFO",
            "formatter": "standard",
            "stream": "ext://sys.stdout"
        },
        "file": {
            "class": "logging.handlers.RotatingFileHandler",
            "level": "DEBUG",
            "formatter": "standard",
            "filename": "logs/mcs.log",
            "maxBytes": 10485760,
            "backupCount": 5
        }
    },
    "loggers": {
        "mcs.api.communication.services.internal_state": {
            "level": "INFO",
            "handlers": ["console", "file"],
            "propagate": false
        },
        "mcs.api.communication.services.tag_cache": {
            "level": "INFO",
            "handlers": ["console", "file"],
            "propagate": false
        }
    },
    "root": {
        "level": "INFO",
        "handlers": ["console", "file"]
    }
} 